{
  "schema": "claude.agent.repo/1",
  "repo": "JerryBalmer1/claude.agent.core",
  "branches": {
    "main": "main",
    "develop": "develop",
    "feature_prefix": "feature/"
  },
  "flow": [
    [ "feature/*", "develop" ],
    [ "develop", "main" ]
  ],
  "merge": {
    "strategy": "merge",
    "delete_branch_on_merge": true
  },
  "review": {
    "mode": "human",
    "note": "human from birth; core is a clean copy and every commit after the first is a merge, so there is always a human on the other side of the flow"
  },
  "required_checks": [
    "requires-header",
    "trailer-guard",
    "branch-flow",
    "generated-match-config",
    "pester",
    "forensic-verify"
  ],
  "scripts": {
    "requires_version": "7.4"
  },
  "runtimes": {
    "powershell": "7.4",
    "python": {
      "version": "3.10",
      "allowed_under": [ "modules/ledger/python/" ]
    },
    "rule": [
      "PowerShell 7.4+ for everything this repo does. No bash, sh, or heredocs.",
      "Python is permitted in exactly one place, `modules/ledger/python/`, and only because the ledger engine must be a separate process: `LedgerPythonMissing`, `LedgerSnakeFailed`, `LedgerNoResult` and `LedgerResultMismatch` exist because the module holds strings, not objects, and cannot attest to a retry count it never observed.",
      "An in-process port would delete four pinned error ids and leave the lying-snake fixture nothing to lie to.",
      "`config/repo.json` -> `runtimes.python.allowed_under` enforces the placement, and `scripts/ci/Test-Runtimes.ps1` is what measures it."
    ]
  },
  "tooling": {
    "pester": "5.7.1"
  },
  "trailer": {
    "key": "who",
    "allowed": [ "claude" ]
  },
  "pull_request": {
    "sections": [
      { "heading": "What", "prompt": "What is true after this merges, in prose. Not a list of what you did -- what is different, and how would someone tell?" },
      { "heading": "How", "collapsible": true, "open": true, "prompt": "One block per commit, and repeat this block per commit: the sha first, then every file touched as a sha-pinned permalink, then what changed and why. The pr-body-links check rejects a bare path, a URL on a branch name instead of a 40-hex sha, and a line suffix that does not match the #L fragment." },
      { "heading": "Why", "prompt": "The control this serves, or the constraint it removes. Short." },
      { "heading": "Verify", "collapsible": true, "prompt": "The check table, pester counts, and the forensic tip. Paste what you measured, not what you expected." }
    ]
  },
  "owners": [ "@JerryBalmer1" ]
}
